{
  "id": "OC-OPENCLAW-UNSAFE-BLOCKED-001",
  "type": "heartbeat",
  "requested_by": "ChatGPT",
  "goal": "Validate that unsafe task flags are blocked before execution.",
  "expected_status": "BLOCKED",
  "params": {},
  "safety": {
    "production_code_change": false,
    "customer_action": true,
    "secrets_required": false,
    "public_posting": false,
    "paid_ads_change": false,
    "destructive_action": false
  },
  "handoff_required": true
}
