{
  "id": "chatgpt-openclaw-heartbeat-20260513-001",
  "type": "heartbeat",
  "requested_by": "ChatGPT",
  "goal": "Verify that OpenClaw Task Runner is operational from ChatGPT through GitHub Actions and can produce evidence reports.",
  "params": {},
  "safety": {
    "production_code_change": false,
    "customer_action": false,
    "secrets_required": false,
    "public_posting": false,
    "paid_ads_change": false,
    "destructive_action": false
  },
  "expected_status": "PASS"
}
